{
  "asset_contract_version": "external_asset_v2",
  "variant_id": "red_ball_arrow_v1",
  "archetype": "ball",
  "files": {
    "mesh": "red_ball_arrow_v1_rigged.glb",
    "animation_clips": "red_ball_arrow_v1_anim.json"
  },
  "geometry": {
    "up": "y",
    "forward": "+x",
    "unit": "meter"
  },
  "rig": "ball_v1",
  "region_source": "material_name",
  "default_state": "idle",
  "textures": {
    "base_color": "red_ball_arrow_v1_texture_atlas.png"
  },
  "animations": {
    "idle": {
      "clip": "idle",
      "frames": 1,
      "fps": 6,
      "playback": "loop"
    },
    "roll": {
      "clip": "roll",
      "frames": 6,
      "fps": 12,
      "playback": "loop"
    },
    "pop": {
      "clip": "pop",
      "frames": 5,
      "fps": 14,
      "playback": "once"
    },
    "explode": {
      "clip": "explode",
      "frames": 8,
      "fps": 12,
      "playback": "once"
    }
  },
  "world_metrics": {
    "height_world": 0.8,
    "footprint_radius_world": 0.4,
    "eye_height_world": 0.4
  },
  "texture_mode": "flat_region"
}